{
  "schema_version": "1.0",
  "message_type": "result_message",
  "created_at": "2026-07-18T10:06:00Z",
  "safety_flags": {
    "synthetic_local_only": true,
    "mock_only": true,
    "dry_run": true,
    "owner_review_required": true,
    "external_side_effects_allowed": false,
    "external_side_effects_occurred": false,
    "blackboard_write_allowed": false,
    "queue_write_allowed": false,
    "audit_trail_write_allowed": false,
    "worker_dispatch_allowed": false,
    "openclaw_call_allowed": false,
    "hermes_runtime_allowed": false,
    "connector_call_allowed": false,
    "google_sheets_write_allowed": false,
    "follow_up_allowed": false,
    "follow_up_requires_owner_confirmation": true
  },
  "prev_entry_hash": "ffffffffffffffffffffffffffffffffffffffffffffffffffffffffffffffff",
  "execution_class": "AUTO",
  "produced_by": "adapter-worker-mock",
  "parent_task_id": null,
  "role": "result_reporter",
  "result_id": "result-phase3-001",
  "callback_id": "callback-phase3-001",
  "task_id": "task-phase3-001",
  "command_id": "cmd-phase3-001",
  "related_dry_run_id": "dryrun-phase3-001",
  "result_type": "result_message",
  "result_status": "preview_result_not_executed",
  "execution_mode": "mock_only",
  "started_at": null,
  "completed_at": null,
  "summary": "Synthetic mock result; no real execution occurred.",
  "output_preview": "synthetic redacted status preview",
  "error_summary": null,
  "validation_status": "validated_synthetic_local_only",
  "external_side_effects": [],
  "rollback_note": "No rollback needed because nothing was executed.",
  "audit_note": "Preview only; no audit trail was persisted."
}
